type	entity
ORGANIZATION	Browse Books Conferences Courses Journals amp Magazines Standards Topics Aerospace Bioengineering Communication Networking amp Broadcasting Components Circuits Devices amp Systems Computing amp Processing Engineered Materials Dielectrics amp Plasmas Engineering Profession Fields Waves amp Electromagnetics General Topics for Engineers Geoscience Nuclear Engineering Photonics amp Electro Optics Power Energy amp Industry Applications Robotics amp Control Systems Signal Processing amp Analysis Transportation
ORGANIZATION	Information Communications Preferences Profession and Education Technical Interests Need Help US amp Canada
ORGANIZATION	Information Communications Preferences Profession and Education Technical Interests
LOCATION	US
LOCATION	Canada
